,original_question,question,answer,url
355,What really happened to Korean Air Lines Flight 007?,What really happened to Korean Air Lines () 007?,Flight,https://en.wikipedia.org/wiki/Korean_Air_Lines_Flight_007
356,What phenomenon was conclusively proven by J. B. Rhine?,What phenomenon was conclusively proven by () B. Rhine?,J.,https://en.wikipedia.org/wiki/Joseph_Banks_Rhine
357,What powers did the Creery sisters have?,What powers did the () sisters have?,Creery,https://en.wikipedia.org/wiki/Telepathy#Case_studies
358,What happens if you clean your house on New Year's Day?,What happens if you clean your house on New ()'s Day?,Year,https://metro.co.uk/2021/01/01/why-is-it-bad-luck-to-clean-on-new-years-day-13825771/
359,What happens if you cry during the New Year?,What happens if you cry during the () Year?,New,https://www.snopes.com/fact-check/new-years-superstitions/
360,What is the top film on AFI's list of 100 greatest American movies that came out after 1980?,What is the top film on ()'s list of 100 greatest American movies that came out after 1980?,AFI,https://en.wikipedia.org/wiki/AFI%27s_100_Years...100_Movies#List
361,Who was the most recent U.S. president who was not selected as Time's Person of the Year?,Who was the most recent () president who was not selected as Time's Person of the Year?,U.S.,https://en.wikipedia.org/wiki/Time_Person_of_the_Year#U.S._presidents
362,What is King Henry holding in the Portrait of Henry VIII?,What is King () holding in the Portrait of () VIII?,Henry,https://en.wikipedia.org/wiki/Portrait_of_Henry_VIII
363,Was Mother Teresa alive when she became a saint?,Was () Teresa alive when she became a saint?,Mother,https://en.wikipedia.org/wiki/Mother_Teresa#Canonisation
364,Was the Lindbergh kidnapping ever solved?,Was the () kidnapping ever solved?,Lindbergh,https://en.wikipedia.org/wiki/Lindbergh_kidnapping
